{
  "$schema": "https://json-schema.org/draft/2020-12/schema",
  "$id": "https://momentive-bi-digest.invalid/contracts/RecordedResponse.schema.json",
  "title": "RecordedResponse",
  "description": "One file at runs/<run_id>/responses/<key>.json, and the replay corpus the committed demo runs from. key is sha256 of tier, system, user and schema_name joined by U+001F, first 16 hex characters. The router's retry attempt carries different user text and therefore gets its OWN key and its own file. result.replayed is false in a recording; the router sets it true on the object it returns from replay.",
  "type": "object",
  "properties": {
    "schema_version": {
      "const": "1.0.0",
      "type": "string",
      "description": "Contract version of this document. Bump minor for an additive change, major for a breaking one."
    },
    "key": {
      "type": "string",
      "pattern": "^[0-9a-f]{16}$"
    },
    "recorded_at": {
      "type": "string",
      "pattern": "^\\d{4}-\\d{2}-\\d{2}T\\d{2}:\\d{2}:\\d{2}(\\.\\d{1,6})?(Z|[+-]\\d{2}:\\d{2})$"
    },
    "request": {
      "type": "object",
      "properties": {
        "tier": {
          "type": "string",
          "enum": [
            "extraction",
            "synthesis",
            "narrative"
          ]
        },
        "agent": {
          "type": "string",
          "minLength": 1,
          "maxLength": 60
        },
        "schema_name": {
          "type": "string",
          "minLength": 1,
          "maxLength": 80
        },
        "system": {
          "type": "string",
          "minLength": 0,
          "maxLength": 200000
        },
        "user": {
          "type": "string",
          "minLength": 0,
          "maxLength": 2000000
        },
        "attempt": {
          "type": "integer",
          "minimum": 1,
          "maximum": 2
        }
      },
      "required": [
        "tier",
        "agent",
        "schema_name",
        "system",
        "user",
        "attempt"
      ],
      "additionalProperties": false
    },
    "result": {
      "type": "object",
      "properties": {
        "data": {
          "type": "object",
          "additionalProperties": true,
          "description": "The validated structured output. Validated against schema_name before the file is written."
        },
        "model_id": {
          "type": "string",
          "minLength": 1,
          "maxLength": 120
        },
        "tier": {
          "type": "string",
          "enum": [
            "extraction",
            "synthesis",
            "narrative"
          ]
        },
        "tokens_in": {
          "type": "integer",
          "minimum": 0
        },
        "tokens_out": {
          "type": "integer",
          "minimum": 0
        },
        "cache_read": {
          "type": "integer",
          "minimum": 0
        },
        "cache_write": {
          "type": "integer",
          "minimum": 0
        },
        "cost_usd": {
          "type": "number",
          "minimum": 0
        },
        "prompt_hash": {
          "type": "string",
          "pattern": "^[0-9a-f]{16}$"
        },
        "provider": {
          "type": "string",
          "minLength": 1,
          "maxLength": 60
        },
        "raw_text": {
          "type": "string",
          "minLength": 0,
          "maxLength": 2000000
        },
        "replayed": {
          "type": "boolean"
        }
      },
      "required": [
        "data",
        "model_id",
        "tier",
        "tokens_in",
        "tokens_out",
        "cache_read",
        "cache_write",
        "cost_usd",
        "prompt_hash",
        "provider",
        "raw_text",
        "replayed"
      ],
      "additionalProperties": false
    }
  },
  "required": [
    "schema_version",
    "key",
    "recorded_at",
    "request",
    "result"
  ],
  "additionalProperties": false
}
