{
  "schema_version": "1.0.0",
  "key": "c4a9ae8cf5d850f3",
  "recorded_at": "2026-09-15T03:01:18.255Z",
  "request": {
    "tier": "extraction",
    "agent": "gong_reader",
    "schema_name": "ReaderOutput",
    "system": "You read one recorded customer call for Momentive Software and return every claim the client made. You return one JSON object matching the ReaderOutput schema and nothing else.\n\nA claim is a client-side statement about the product: how it behaves, a capability it lacks, what it costs, or an integration it needs. It is one of these six things: a feature request, a support issue, a churn risk, a pricing remark, an integration need, or praise. Praise counts only when the client is explicitly praising the product.\n\nNothing else is a claim. Logistics, scheduling, staffing and headcount, who is away, training and onboarding wishes, how often a board is updated, thanks, apologies and general organisational context are never claims, however firmly the client says them. A useful test: if the sentence would read the same with the product taken out of it, it is not a claim.\n\nOnly the client side counts. Every turn header says `client` or `momentive`. Quote client turns only. A Momentive Software employee's statement is never a claim, not even when the employee reports what customers want. \"A lot of our customers ask for this\" spoken on a `momentive` turn is an employee summarising, not a client claim, and a claim quoting it is thrown away.\n\nThe verbatim decides whether a claim survives. A citation verifier checks that your verbatim is an exact substring of the turn text, character for character. A rejected claim is worse than a missed one, so quote less and quote exactly.\n\n- Copy the words from ONE turn, contiguous, exactly as they appear.\n- Between 8 and 60 words.\n- Never span two turns and never span two speakers.\n- No ellipsis, no paraphrase, no tidying, no changed punctuation, spelling or capitalisation, no added or removed spaces.\n- Each sentence of a turn is preceded by a timing marker such as `(418000-430500)`. The markers are not words anyone said. Leave every marker out of verbatim. If your quote runs across a sentence boundary, drop the marker that sits between the two sentences and join them with exactly one space, which is how the turn reads without markers.\n- `[EMAIL]`, `[PHONE]`, `[ADDRESS]` and `[NAME]` are redaction placeholders standing in for personal data that was removed before you saw the call. Treat each as one ordinary opaque word. You may quote across one. Never guess what it hid and never write a real name, address, phone number or email address of your own.\n\n`source_ref` has exactly four fields: `call_id`, `speaker_id`, `start_ms` and `end_ms`. Copy all four from the header of the turn you quoted, exactly as shown. Do not compute them, do not copy a sentence marker into them, do not round. The sentence markers exist so you can pick a contiguous span to quote, not to be copied into `source_ref`.\n\nFor each claim also give:\n\n- `claim_type`, one of `feature_request`, `support_issue`, `churn_risk`, `pricing`, `integration`, `praise`.\n- `product_area`, one of `membership`, `events`, `fundraising`, `lms`, `jobs`, `accounting`, `integrations`, `reporting`.\n- `topic`, a short noun phrase, not a sentence.\n- `paraphrase`, one plain sentence a product manager can read on its own.\n- `importance`, one of `high`, `medium`, `low`, and `importance_reason`, one sentence saying why.\n\nOne claim per distinct underlying point per document. A problem and the fix the client asks for are ONE point, not two: \"postings expire without warning\" and \"give us a week of notice before they expire\" are the same point, so return a single claim for them and pick the claim_type that matches the client's own emphasis. If a product manager would read two of your claims as the same ask, they were one claim.\n\nQuote the FIRST and fullest statement of a point. A client often raises a point early in full and comes back to it later in shorter words. Cite the earlier, fuller turn. The later restatement is not a second claim and is not the quote to use.\n\nWhen in doubt, return fewer claims. A short list where every citation is exact beats a long one.\n\nIf the call contains no client claim, for example a discovery call where only the Momentive Software side asks questions, or a call that is all scheduling and logistics, return `\"claims\": []` and one sentence in `no_claims_reason`. When `claims` is not empty, `no_claims_reason` must be null.\n\n`source` is `\"gong\"` on the output and on every claim. `source_id` is the call id you were given. `schema_version` is `\"1.0.0\"`.",
    "user": "Call 7782934451901, account Copper Ridge Youth Foundation, call on 2026-09-09T16:00:00Z.\nTitle: Copper Ridge Youth Foundation reporting review\n\nParticipants:\n- Denise Kohler (client), Director of Programs\n- Priya Natarajan (momentive), Account Executive\n\nTurns. Each header reads `[turn N | speaker_id S | name | side | start_ms-end_ms]`. The `speaker_id` value and the `start_ms-end_ms` pair, together with call id 7782934451901, are the locator to copy into `source_ref` for any claim quoting that turn.\n\n[turn 1 | speaker_id 8801 | Denise Kohler | client | 300000-321000]\n(300000-321000) Every export from the reporting module stops at five thousand rows with no warning, so [NAME] on my team rebuilds the quarter by hand and mails it to [EMAIL], and what we need is an export that carries a whole quarter in one pass.\n\n[turn 2 | speaker_id 3310 | Priya Natarajan | momentive | 321000-333000]\n(321000-326000) A lot of our customers ask for this. (326000-333000) I can take the row limit back to the reporting team this week.\n\n[turn 3 | speaker_id 8801 | Denise Kohler | client | 333000-352000]\n(333000-341000) Back to the export, the five thousand row cap is the thing that costs us the most. (341000-352000) We are also two people short on the events team this quarter, and I still need to book the refresher training for the new hires before the board meets in November.\n\nReturn the ReaderOutput JSON for call 7782934451901.",
    "attempt": 1
  },
  "result": {
    "data": {
      "schema_version": "1.0.0",
      "source": "gong",
      "source_id": "7782934451901",
      "claims": [
        {
          "source": "gong",
          "source_ref": {
            "call_id": "7782934451901",
            "speaker_id": "8801",
            "start_ms": 300000,
            "end_ms": 321000
          },
          "verbatim": "Every export from the reporting module stops at five thousand rows with no warning, so [NAME] on my team rebuilds the quarter by hand and mails it to [EMAIL], and what we need is an export that carries a whole quarter in one pass.",
          "paraphrase": "The export function is limited to 5,000 rows without warning and requires manual workarounds; clients need to export full quarterly data in one operation.",
          "topic": "Export row limit",
          "product_area": "reporting",
          "claim_type": "feature_request",
          "importance": "high",
          "importance_reason": "The client explicitly states this is the most costly issue, causing manual quarterly data reconstruction."
        }
      ],
      "no_claims_reason": null
    },
    "model_id": "claude-haiku-4-5",
    "tier": "extraction",
    "tokens_in": 36,
    "tokens_out": 4601,
    "cache_read": 138095,
    "cache_write": 48354,
    "cost_usd": 0.097293,
    "prompt_hash": "81e41665a0ce6471",
    "provider": "agent_sdk_seat",
    "raw_text": "{\"schema_version\": \"1.0.0\", \"source\": \"gong\", \"source_id\": \"7782934451901\", \"claims\": [{\"source\": \"gong\", \"source_ref\": {\"call_id\": \"7782934451901\", \"speaker_id\": \"8801\", \"start_ms\": 300000, \"end_ms\": 321000}, \"verbatim\": \"Every export from the reporting module stops at five thousand rows with no warning, so [NAME] on my team rebuilds the quarter by hand and mails it to [EMAIL], and what we need is an export that carries a whole quarter in one pass.\", \"paraphrase\": \"The export function is limited to 5,000 rows without warning and requires manual workarounds; clients need to export full quarterly data in one operation.\", \"topic\": \"Export row limit\", \"product_area\": \"reporting\", \"claim_type\": \"feature_request\", \"importance\": \"high\", \"importance_reason\": \"The client explicitly states this is the most costly issue, causing manual quarterly data reconstruction.\"}], \"no_claims_reason\": null}",
    "replayed": false
  }
}
