{
  "schema_version": "1.0.0",
  "key": "a5a6d6e95b77b7b7",
  "recorded_at": "2026-09-15T00:27:33.788Z",
  "request": {
    "tier": "extraction",
    "agent": "sfdc_reader",
    "schema_name": "ReaderOutput",
    "system": "You read one support case thread for Momentive Software and return every claim the client made. You return one JSON object matching the ReaderOutput schema and nothing else.\n\nA claim is a client-side statement that is one of these six things: a feature request, a support issue, a churn risk, a pricing remark, an integration need, or praise.\n\nOnly the client side counts. Every comment header says `client` or `momentive`. Quote client comments only. A Momentive Software employee's comment is never a claim, not even when the employee reports what customers want. \"A lot of our customers ask for this\" written on a `momentive` comment is an employee summarising, not a client claim, and a claim quoting it is thrown away.\n\nThe verbatim decides whether a claim survives. A citation verifier checks that your verbatim is an exact substring of the comment text, character for character. A rejected claim is worse than a missed one, so quote less and quote exactly.\n\n- Copy the words from ONE comment, contiguous, exactly as they appear.\n- Between 8 and 60 words.\n- Never span two comments and never span two authors.\n- No ellipsis, no paraphrase, no tidying, no changed punctuation, spelling or capitalisation, no added or removed spaces. Line breaks inside a comment are part of the text, so quote a run that sits on one line.\n- `[EMAIL]`, `[PHONE]`, `[ADDRESS]` and `[NAME]` are redaction placeholders standing in for personal data that was removed before you saw the case. Treat each as one ordinary opaque word. You may quote across one. Never guess what it hid and never write a real name, address, phone number or email address of your own.\n\n`source_ref` has exactly two fields: `case_id` and `comment_id`. `case_id` is the case id you were given. `comment_id` is copied from the header of the comment you quoted, exactly as shown. Do not compute either and do not invent an id.\n\nFor each claim also give:\n\n- `claim_type`, one of `feature_request`, `support_issue`, `churn_risk`, `pricing`, `integration`, `praise`.\n- `product_area`, one of `membership`, `events`, `fundraising`, `lms`, `jobs`, `accounting`, `integrations`, `reporting`.\n- `topic`, a short noun phrase, not a sentence.\n- `paraphrase`, one plain sentence a product manager can read on its own.\n- `importance`, one of `high`, `medium`, `low`, and `importance_reason`, one sentence saying why.\n\nOne claim per distinct point. If the same client makes the same point twice, quote it once. If the thread contains no client claim, for example a case where only the Momentive Software side has written, return `\"claims\": []` and one sentence in `no_claims_reason`. When `claims` is not empty, `no_claims_reason` must be null.\n\n`source` is `\"salesforce\"` on the output and on every claim. `source_id` is the case id you were given. `schema_version` is `\"1.0.0\"`.",
    "user": "Case 5008W00002bRtMzQAK, account Cascadia Nurses Association, case opened 2026-09-09T13:04:11Z.\nSubject: Event check-in unusable when venue wifi drops\n\nParticipants:\n- Halina Brzezinski (client)\n- Elena Kowalczyk (momentive)\n\nComments, oldest first. Each header reads `[turn N | comment_id C | name | side | created_at]`. The `comment_id` value, together with case id 5008W00002bRtMzQAK, is the locator to copy into `source_ref` for any claim quoting that comment. Private internal comments were filtered out before you saw this thread, so what is here is the whole thread you may cite.\n\n[turn 1 | comment_id 00aB000001kLmNoIAO | Halina Brzezinski | client | 2026-09-09T13:04:11Z]\nEvent check-in went down at our regional conference when the venue wifi dropped and the volunteers wrote names on paper for forty minutes. We need check-in to keep working offline and sync once the connection comes back.\n\n[turn 2 | comment_id 00aB000001kLmNoIAP | Elena Kowalczyk | momentive | 2026-09-09T15:40:02Z]\nThanks for the detail. A lot of our customers ask for this, and I have logged it with the events team.\n\nReturn the ReaderOutput JSON for case 5008W00002bRtMzQAK.",
    "attempt": 1
  },
  "result": {
    "data": {
      "schema_version": "1.0.0",
      "source": "salesforce",
      "source_id": "5008W00002bRtMzQAK",
      "claims": [
        {
          "source": "salesforce",
          "source_ref": {
            "case_id": "5008W00002bRtMzQAK",
            "comment_id": "00aB000001kLmNoIAO"
          },
          "verbatim": "Event check-in went down at our regional conference when the venue wifi dropped and the volunteers wrote names on paper for forty minutes. We need check-in to keep working offline and sync once the connection comes back.",
          "paraphrase": "The client needs event check-in to remain functional during WiFi outages and automatically synchronize data when connectivity is restored.",
          "topic": "offline check-in with synchronization",
          "product_area": "events",
          "claim_type": "feature_request",
          "importance": "high",
          "importance_reason": "The check-in system became unusable during a live event when WiFi dropped, preventing proper attendee tracking and requiring manual workarounds."
        }
      ],
      "no_claims_reason": null
    },
    "model_id": "claude-haiku-4-5",
    "tier": "extraction",
    "tokens_in": 20,
    "tokens_out": 4194,
    "cache_read": 85009,
    "cache_write": 5493,
    "cost_usd": 0.03635715,
    "prompt_hash": "f088d24e7246a237",
    "provider": "agent_sdk_seat",
    "raw_text": "{\"schema_version\": \"1.0.0\", \"source\": \"salesforce\", \"source_id\": \"5008W00002bRtMzQAK\", \"claims\": [{\"source\": \"salesforce\", \"source_ref\": {\"case_id\": \"5008W00002bRtMzQAK\", \"comment_id\": \"00aB000001kLmNoIAO\"}, \"verbatim\": \"Event check-in went down at our regional conference when the venue wifi dropped and the volunteers wrote names on paper for forty minutes. We need check-in to keep working offline and sync once the connection comes back.\", \"paraphrase\": \"The client needs event check-in to remain functional during WiFi outages and automatically synchronize data when connectivity is restored.\", \"topic\": \"offline check-in with synchronization\", \"product_area\": \"events\", \"claim_type\": \"feature_request\", \"importance\": \"high\", \"importance_reason\": \"The check-in system became unusable during a live event when WiFi dropped, preventing proper attendee tracking and requiring manual workarounds.\"}], \"no_claims_reason\": null}",
    "replayed": false
  }
}
