{
  "schema_version": "1.0.0",
  "key": "e4f9bf13691bca1a",
  "recorded_at": "2026-09-15T03:01:35.335Z",
  "request": {
    "tier": "synthesis",
    "agent": "editor",
    "schema_name": "EditorThemeRequest",
    "system": "You are the editor of a weekly theme digest for a product team at Momentive Software.\n\nThis is the first of two calls and you are not deciding anything yet. You have the theme\nindex, which is one line per theme already in the store, this week's verified claims, and\nthe deterministic account enrichment. Your only job on this call is to name the themes you\nneed to read in full before you can decide where this week's claims belong.\n\nRead the index first and read it as a list of problems, not a list of titles. Ask for a\ntheme when a claim might be the same underlying problem as that theme and one line is not\nenough to be sure. Three rules decide what \"might be\" means, and they are the same three\nrules you will apply on the next call:\n\n1. The same underlying problem described in different words is the SAME theme. A claim can\n   share no keyword at all with a theme title and still belong to it. Judge the problem, not\n   the vocabulary.\n2. The same capability under two product names is the SAME theme. Two product lineages often\n   carry two names for one feature, and the index line only has room for one of them, so\n   check the aliases column and then ask for the theme anyway when the capability matches.\n3. Two different problems that happen to share a word are DIFFERENT themes. A shared noun is\n   not evidence.\n\nAsk for what you need and nothing more. Every theme you name is opened, logged, and placed\nin front of you on the next call, so a long list buries the evidence that actually decides\nsomething. An empty list is a legal answer and means the index was enough.\n\nOnly ids that appear in the index can be opened. An id that is not in the index is dropped\nand the drop is logged, so inventing one costs you a read and gains you nothing.\n\nReturn only a JSON object valid against the EditorThemeRequest schema. No prose before it,\nno prose after it, no code fence around it.",
    "user": "Week: 2026-W37\nBuild run: 2026-09-14T07:00Z\n\n## Theme index\n\n- THEME-0001 | Report exports truncate above ten thousand rows | area reporting | status open | score 61 | accounts 1 | evidence 1 | last updated 2026-09-07T07:00Z | aliases: export cap; report truncation\n- THEME-0002 | General ledger sync leaves journal entries unposted | area accounting | status quiet | score 34 | accounts 1 | evidence 1 | last updated 2026-08-24T07:00Z | aliases: GL sync; journal posting\n\n## This week's verified claims\n\n- claim_id: c3b56df75918\n  account: ACC-0001 Great Lakes Museum Alliance (customer)\n  type: support_issue | importance: high | product_area: membership\n  topic: renewal statement totals\n  paraphrase: Renewal statements leave out the amount carried over from the previous period, so the total is wrong.\n  verbatim: The renewal statement that went out last week is missing the amount we already carried over from the previous period, so the total is wrong before anyone even looks at it.\n  cited at: call 7782934451002 at 12:34 (gong)\n- claim_id: 198800c61452\n  account: ACC-0003 Prairie Land Trust Council (customer)\n  type: support_issue | importance: high | product_area: membership\n  topic: mid year upgrade billing\n  paraphrase: Members who upgrade mid year are billed the full amount again and finance corrects each invoice by hand.\n  verbatim: Members who upgraded in the middle of the year are being billed the full amount again with nothing knocked off, and finance has to fix every one of them by hand.\n  cited at: case 00010423 comment 00a8W00001bQmTzQAK (salesforce)\n- claim_id: 20307221a9c0\n  account: ACC-0002 Cascadia Nurses Association (customer)\n  type: feature_request | importance: high | product_area: events\n  topic: event check-in offline\n  paraphrase: Event check-in needs to keep working when venue wifi drops and sync once connectivity returns.\n  verbatim: Our event check-in has to keep working when the venue wifi drops, and then sync everything up once we are back online.\n  cited at: call 7782934451118 at 04:48 (gong)\n- claim_id: f1789761d731\n  account: ACC-0004 Atlantic Shipwrights Guild (customer)\n  type: feature_request | importance: medium | product_area: events\n  topic: attendee kiosk offline\n  paraphrase: The attendee kiosk must stay usable through a wifi outage, as it did on their previous platform.\n  verbatim: On our previous platform the attendee kiosk stayed up when the wifi went down, and we need the attendee kiosk to do the same here.\n  cited at: call 7782934451207 at 08:41 (gong)\n- claim_id: 3edca0426f5a\n  account: ACC-0007 Northwoods Arborists Society (prospect)\n  type: feature_request | importance: medium | product_area: lms\n  topic: SCORM package upload\n  paraphrase: Wants SCORM 1.2 and SCORM 2004 package upload in the learning platform without repackaging.\n  verbatim: We need to be able to upload SCORM 1.2 and SCORM 2004 packages into the learning platform without repackaging them first.\n  cited at: call 7782934451311 at 03:19 (gong)\n- claim_id: 820a671defdf\n  account: ACC-0005 Sunbelt Literacy Network (customer)\n  type: support_issue | importance: high | product_area: fundraising\n  topic: pledge reminder frequency\n  paraphrase: Pledge reminders go out more often than the donor asked for.\n  verbatim: We set this donor down for one pledge reminder a year and the system sent her four of them anyway.\n  cited at: call 7782934451402 at 10:45 (gong)\n- claim_id: fa6536c5ff93\n  account: ACC-0001 Great Lakes Museum Alliance (customer)\n  type: support_issue | importance: high | product_area: fundraising\n  topic: pledge reminder channel preference\n  paraphrase: Pledge reminder emails reach donors who opted for paper only.\n  verbatim: Donors who chose paper only are still getting the pledge reminder emails, which is exactly what they told us they did not want.\n  cited at: case 00010451 comment 00a8W00001bQmUxQAK (salesforce)\n- claim_id: f9b51cbdab89\n  account: ACC-0006 Copper Ridge Youth Foundation (customer)\n  type: support_issue | importance: high | product_area: reporting\n  topic: report export row cap\n  paraphrase: Exports stop at ten thousand rows, so staff run the export repeatedly and merge the files.\n  verbatim: The membership export stops at ten thousand rows, so we run it four times and staple the files together.\n  cited at: call 7782934451119 at 05:36 (gong)\n\n## Account enrichment\n\n- ACC-0001 Great Lakes Museum Alliance | customer | tier enterprise | ARR 340000 USD | open cases 3 | products: membership, events, fundraising, reporting\n- ACC-0002 Cascadia Nurses Association | customer | tier enterprise | ARR 268000 USD | open cases 2 | products: membership, events, lms, reporting\n- ACC-0003 Prairie Land Trust Council | customer | tier professional | ARR 154000 USD | open cases 2 | products: membership, fundraising, accounting\n- ACC-0004 Atlantic Shipwrights Guild | customer | tier professional | ARR 96000 USD | open cases 1 | products: membership, events, jobs\n- ACC-0005 Sunbelt Literacy Network | customer | tier standard | ARR 41000 USD | open cases 1 | products: fundraising, accounting\n- ACC-0006 Copper Ridge Youth Foundation | customer | tier standard | ARR 18000 USD | open cases 1 | products: membership, reporting\n- ACC-0007 Northwoods Arborists Society | prospect | tier prospect | ARR 0 USD | open cases 0 | products: lms\n\n## Flagged quiet or stale by code\n\n- THEME-0002 General ledger sync leaves journal entries unposted: status quiet, 21 days since its last update, past the fourteen day horizon\n\nName the themes you need opened in full.",
    "attempt": 1
  },
  "result": {
    "data": {
      "schema_version": "1.0.0",
      "needs_themes": [
        "THEME-0001",
        "THEME-0002"
      ]
    },
    "model_id": "claude-opus-5",
    "tier": "synthesis",
    "tokens_in": 2,
    "tokens_out": 583,
    "cache_read": 56473,
    "cache_write": 2374,
    "cost_usd": 0.057659,
    "prompt_hash": "8a9398a500f46b31",
    "provider": "agent_sdk_seat",
    "raw_text": "{\"schema_version\": \"1.0.0\", \"needs_themes\": [\"THEME-0001\", \"THEME-0002\"]}",
    "replayed": false
  }
}
