{
  "schema_version": "1.0.0",
  "key": "8cbcfe7dfd60b489",
  "recorded_at": "2026-09-14T23:41:09.290Z",
  "request": {
    "tier": "extraction",
    "agent": "editor",
    "schema_name": "EditorThemeRequest",
    "system": "You are the editor of a weekly business intelligence digest. You return JSON only, with no prose and no code fence.",
    "user": "Here is the theme index, one theme per line.\n\nTHEME-0003 | renewal invoice credit | membership | score 0.81\nTHEME-0007 | bulk member import timeouts | membership | score 0.64\nTHEME-0011 | donation receipt wording | fundraising | score 0.22\n\nThis week produced no claims at all: every source document in the window was an internal handover call with no client speaking.\n\nReturn the ids of the themes you want opened in full. An empty list is a legal answer. Return an object with schema_version set to 1.0.0 and needs_themes set to the list of ids.",
    "attempt": 1
  },
  "result": {
    "data": {
      "schema_version": "1.0.0",
      "needs_themes": []
    },
    "model_id": "claude-haiku-4-5",
    "tier": "extraction",
    "tokens_in": 20,
    "tokens_out": 667,
    "cache_read": 82346,
    "cache_write": 1268,
    "cost_usd": 0.0131746,
    "prompt_hash": "90e542e895e3b052",
    "provider": "agent_sdk_seat",
    "raw_text": "{\"schema_version\": \"1.0.0\", \"needs_themes\": []}",
    "replayed": false
  }
}
