{
  "schema_version": "1.0.0",
  "key": "b58312947d7123a3",
  "recorded_at": "2026-09-15T00:34:59.014Z",
  "request": {
    "tier": "narrative",
    "agent": "analyst",
    "schema_name": "AnalystAnswer",
    "system": "You are the analyst for a weekly business intelligence digest built for Momentive Software. A product manager asks you a question. You answer it using only the theme store excerpts given to you below, in this one prompt. You have no other access: no raw call transcripts, no support cases, no memory of any earlier question, no outside knowledge of Momentive Software or its customers.\n\nRules, always:\n\n- Answer only from the retrieved themes and evidence given to you below. Never bring in anything you were not shown.\n- Cite the theme id and the claim id for every factual sentence, using only the ids that appear in the context below. A sentence with a fact and no citation is not allowed.\n- Never name an account, a number or any fact that is not present in the context below.\n- If the question asks about something the context does not cover, decline: set `supported` to false, leave `citations` empty, and give one short, plain sentence in `decline_reason` saying the store has nothing on it. Do not guess and do not stretch a loosely related theme into an answer it does not support.\n- Write in plain language a product manager would use. No marketing language, no jargon.\n- Keep the answer under 150 words unless the question itself asks for more detail.\n- Return only a JSON object matching the AnalystAnswer schema, `schema_version` set to `\"1.0.0\"`, `question` set to the question you were asked. No prose outside the JSON, no markdown fence around it.",
    "user": "Question: why does the renewal credit issue matter\n\nRetrieved context from the theme store, the only source of truth you have:\n\nTheme THEME-0003: Renewal invoices do not show prior dues credit\n## Why this matters\n\nOne customer reports that renewal invoices carry the full annual amount with no line for dues already paid, and finance corrects it by hand every time it happens.\n\n## Evidence\n\n| claim_id | account | source | moment | verbatim |\n| --- | --- | --- | --- | --- |\n| e7e3c117f5c5 | Great Lakes Museum Alliance | gong | call 7782934451002 at 06:58, Dana Ruiz | Our renewal invoice came through with the full annual amount and there is no line anywhere showing the dues we already paid in March. |\n\nAnswer the question above using only this context. If it does not support an answer, decline instead of guessing.",
    "attempt": 1
  },
  "result": {
    "data": {
      "schema_version": "1.0.0",
      "question": "why does the renewal credit issue matter",
      "answer": "It matters because renewal invoices go out at the full annual amount with no line showing dues the customer already paid, so the invoice overstates what is owed (THEME-0003, e7e3c117f5c5). One customer reported this on a call, saying their renewal invoice showed the full annual amount with no line for dues paid in March (THEME-0003, e7e3c117f5c5). The theme notes finance corrects the invoice by hand each time it happens, which is recurring manual work (THEME-0003, e7e3c117f5c5). Note the evidence here is a single customer, so the scale beyond that account is not covered by the store.",
      "supported": true,
      "citations": [
        {
          "theme_id": "THEME-0003",
          "claim_id": "e7e3c117f5c5"
        }
      ],
      "decline_reason": null
    },
    "model_id": "claude-opus-5",
    "tier": "narrative",
    "tokens_in": 2,
    "tokens_out": 290,
    "cache_read": 0,
    "cache_write": 57445,
    "cost_usd": 0.36629125,
    "prompt_hash": "d8228a6cbc44667e",
    "provider": "agent_sdk_seat",
    "raw_text": "{\"schema_version\":\"1.0.0\",\"question\":\"why does the renewal credit issue matter\",\"answer\":\"It matters because renewal invoices go out at the full annual amount with no line showing dues the customer already paid, so the invoice overstates what is owed (THEME-0003, e7e3c117f5c5). One customer reported this on a call, saying their renewal invoice showed the full annual amount with no line for dues paid in March (THEME-0003, e7e3c117f5c5). The theme notes finance corrects the invoice by hand each time it happens, which is recurring manual work (THEME-0003, e7e3c117f5c5). Note the evidence here is a single customer, so the scale beyond that account is not covered by the store.\",\"supported\":true,\"citations\":[{\"theme_id\":\"THEME-0003\",\"claim_id\":\"e7e3c117f5c5\"}],\"decline_reason\":null}",
    "replayed": false
  }
}
